### ISSUE TITLE
Connection issue between Host and container

### ISSUE THREAD

**Issue by cbenejean** [docker-library/postgres#663]
I have an issue with the posgresql container running on a particular server.

The same image with the same backup and with the exact same version of docker-engine is running on another machine.

The problem seems to be the communication between the host and the postgre container (named xxxx).

When I launch the docker with:

sudo docker run --restart=always -p 5432:5432 --name xxxx -v xxxx/pgdata:/var/lib/postgresql/data -e POSTGRES_PASSWORD=xxxx -e POSTGRES_USER=xxxx -d postgres

I can see the port on host is open in listen mode:

$ netstat -at
Active Internet connections (servers and established)
Proto Recv-Q Send-Q Local Address           Foreign Address         State     
...
tcp6       0      0 [::]:postgresql         [::]:*                  LISTEN 
...
I can see the packet reaching the HOST with tcpdump on the host:

$ sudo tcpdump tcp port 5432
tcpdump: verbose output suppressed, use -v or -vv for full protocol decode
listening on docker0, link-type EN10MB (Ethernet), capture size 262144 bytes
08:14:30.180517 IP 172.17.0.2.54798 > 172.16.100.124.postgresql: Flags [S], seq 2072606591, win 42340, options [mss 1460,sackOK,TS val 2325289624 ecr 0,nop,wscale 14], length 0
08:14:31.187637 IP 172.17.0.2.54798 > 172.16.100.124.postgresql: Flags [S], seq 2072606591, win 42340, options [mss 1460,sackOK,TS val 2325290631 ecr 0,nop,wscale 14], length 0
08:14:33.203642 IP 172.17.0.2.54798 > 172.16.100.124.postgresql: Flags [S], seq 2072606591, win 42340, options [mss 1460,sackOK,TS val 2325292647 ecr 0,nop,wscale 14], length 0

but the packet are not hitting the docker... same tcpdump in the container doesn't show the packets.

The issue seems to be between the host and the container, network issue certainly.

I have another container (another application, adminer) on the same host, I can reach it using port 8001. It seems to be image related.

I'm not sure where to look to debug this.

docker engine version:
Client: Docker Engine - Community
 Version:           19.03.5
 API version:       1.40
 Go version:        go1.12.12
 Git commit:        633a0ea838
 Built:             Wed Nov 13 07:29:52 2019
 OS/Arch:           linux/amd64
 Experimental:      false

Server: Docker Engine - Community
 Engine:
  Version:          19.03.5
  API version:      1.40 (minimum version 1.12)
  Go version:       go1.12.12
  Git commit:       633a0ea838
  Built:            Wed Nov 13 07:28:22 2019
  OS/Arch:          linux/amd64
  Experimental:     false
 containerd:
  Version:          1.2.10
  GitCommit:        b34a5c8af56e510852c35414db4c1f4fa6172339
 runc:
  Version:          1.0.0-rc8+dev
  GitCommit:        3e425f80a8c931f88e6d94a8c831b9d5aa481657
 docker-init:
  Version:          0.18.0
  GitCommit:        fec3683

Excecpt these 2 containers, nothing run in the docker:

sudo docker ps -a
CONTAINER ID        IMAGE               COMMAND                  CREATED             STATUS              PORTS                    NAMES
65ccf0765be1        postgres:12.1       "docker-entrypoint.s…"   22 hours ago        Up 22 hours         0.0.0.0:5432->5432/tcp   xxxx
f6737f25f098        adminer             "entrypoint.sh docke…"   4 days ago          Up 22 hours         0.0.0.0:8001->8080/tcp   adminer-sophia

Thanks,
Christophe

**Comment by wglambert** [comment]
```console
$ docker run --restart=always -p 5432:5432 -p 4444:4444 --name xxxx -e POSTGRES_PASSWORD=xxxx -e POSTGRES_USER=xxxx -d postgres 
725338a617ba4575a20f1f48790275eeb62b2e43ba0376fe42d12a61b174648d

$ docker exec -it xxxx bash

root@725338a617ba:/# apt update &>/dev/null && apt install -y netcat net-tools &>/dev/null

root@725338a617ba:/# netcat -vlp 4444
listening on [any] 4444 ...
[echo test | netcat localhost 4444 on host]
172.17.0.1: inverse host lookup failed: Unknown host
connect to [172.17.0.3] from (UNKNOWN) [172.17.0.1] 45810
test
```

Connecting from another container going [container]->host[5432]->[postgres]
```console
$ docker run -it --rm postgres bash

root@43ce403d34ba:/# psql -h 172.17.0.1 -Uxxxx
Password for user xxxx: 
psql (12.1 (Debian 12.1-1.pgdg100+1))
Type "help" for help.

xxxx=#
```

I would try asking over at the [Docker Community Forums](https://forums.docker.com/), [Docker Community Slack](https://dockr.ly/slack), or [Stack Overflow](https://stackoverflow.com/search?tab=newest&q=docker). Since these repos aren't really a user-help forum

**Comment by cbenejean** [comment]
Hi  wglambert ,

Thanks for your answer.

Both of the connection from host port 4444, and from another container worked...

I'm just puzzled.

**Comment by wglambert** [comment]
Going to close since this seems to be a host configuration issue and not an issue in the image
